{
  "eyebrow": "Voice-powered website engine",
  "headline": "Speak your concept. Preview a full homepage. Reserve the source.",
  "subheadline": "The homepage now leads with a live builder experience and a buyable source pack you can generate from voice or a typed brief.",
  "primaryCta": {
    "label": "Generate preview",
    "to": "#website-generator"
  },
  "secondaryCta": {
    "label": "Browse source packs",
    "to": "/products"
  },
  "operatorSignals": [
    "voice-first builder",
    "live preview engine",
    "source delivery",
    "checkout-ready"
  ],
  "heroStats": [
    {
      "label": "Voice builder",
      "value": "Live on the homepage"
    },
    {
      "label": "Preview studio",
      "value": "Scroll-ready homepage mockup"
    },
    {
      "label": "Source delivery",
      "value": "Reserved by email"
    }
  ],
  "heroPanel": {
    "heading": "A live voice-to-website engine sits here",
    "body": "Generate a scrollable homepage preview, inspect the offer, and reserve the underlying source bundle without leaving the public site.",
    "points": [
      {
        "label": "Instant preview",
        "value": "Client-side rendering makes the experience fast and tactile."
      },
      {
        "label": "Voice capture",
        "value": "Speak your brief or type a conversion-focused offer."
      },
      {
        "label": "Source bundle",
        "value": "Reserve the generated website package for fast checkout."
      }
    ]
  },
  "media": {
    "eyebrow": "Hero engine demo",
    "title": "Watch the builder and source delivery flow in motion",
    "body": "The public site now uses motion and visual polish to make the product feel real and high-value.",
    "videoUrl": "/media/hero-operator.mp4",
    "posterUrl": "/media/operator-preview.svg",
    "imageUrl": "/media/operator-preview.svg",
    "badges": [
      "Voice input",
      "Preview engine",
      "Source checkout"
    ]
  },
  "workflowHeadline": "A successful customer flow should feel simple from the outside and powerful underneath.",
  "workflowSteps": [
    {
      "title": "Speak the idea",
      "description": "Share the website goal in your own words, from the audience to the offer and the desired action."
    },
    {
      "title": "Generate the preview",
      "description": "The engine turns that intent into a visual homepage concept, complete with hero media and an offer lane."
    },
    {
      "title": "Reserve the source",
      "description": "Buy a source bundle or open the app store and use the generated preview as a product-ready starting point."
    }
  ],
  "audienceIntro": "The homepage now speaks directly to the buyers who want speed, clarity, and a usable launch asset.",
  "audiences": [
    {
      "title": "Founders",
      "description": "Get a launch-ready page faster without hiring a full web team.",
      "bullets": [
        "Convert ideas into a visible homepage instantly",
        "Keep the experience focused on offer and action",
        "Reserve a source bundle for quick deployment"
      ]
    },
    {
      "title": "Agencies",
      "description": "Standardize delivery with a preview-first intake flow and sell source packs confidently.",
      "bullets": [
        "Use preview builds to close more proposals",
        "Offer a tangible source package to clients",
        "Save time on initial page design and copy"
      ]
    },
    {
      "title": "Technical teams",
      "description": "Manage generated assets, approvals, and checkout-ready delivery from one system.",
      "bullets": [
        "Keep generated builds in a repository-friendly format",
        "Support self-hosted and governed launch paths",
        "Reduce manual handoffs between marketing and engineering"
      ]
    }
  ],
  "proofHeadline": "The site should make the business model obvious.",
  "proofCards": [
    {
      "eyebrow": "Recurring revenue",
      "title": "Subscription software",
      "description": "Use the platform itself as the recurring core offer for founders and teams that need AI-managed delivery.",
      "outcome": "Monthly revenue with expansion into seats, usage, and support."
    },
    {
      "eyebrow": "Cash flow",
      "title": "Launch and automation sprints",
      "description": "Sell implementation packages to help customers set up workflows, pages, automations, and internal operating systems.",
      "outcome": "Higher-ticket service revenue while the product matures."
    },
    {
      "eyebrow": "High-trust deals",
      "title": "Enterprise deployment",
      "description": "Offer self-hosted deployments, security review, onboarding, and customization for teams that cannot rely on pure SaaS.",
      "outcome": "Larger contracts and lower churn."
    }
  ],
  "productsIntro": "These are the clearest monetization paths for the current product and market position.",
  "faqHeadline": "Questions that matter before a buyer commits",
  "faq": [
    {
      "question": "Is this a website builder or an operations platform?",
      "answer": "It is best positioned as an AI system manager that can also generate and manage website assets. That creates a stronger business and a more differentiated offer."
    },
    {
      "question": "How does the site make money early?",
      "answer": "Early revenue should come from launch sprints and implementation packages, with software subscriptions growing as the platform becomes more productized."
    },
    {
      "question": "Who is the best first customer?",
      "answer": "The best first customers are founders, agencies, and technical operators who already understand the value of automation and are willing to pay for speed."
    }
  ],
  "finalCta": {
    "eyebrow": "Start with the strongest path",
    "heading": "Generate a preview, open the app store, and start selling source packs.",
    "body": "The homepage now pushes toward a clearer revenue path: low-friction builder purchases, higher-demand app-store products, and stronger upsells into implementation or subscription offers.",
    "primaryLabel": "Open the builder",
    "primaryHref": "/",
    "secondaryLabel": "Browse the app store",
    "secondaryHref": "/products"
  },
  "updatedAt": "2026-04-19T00:00:00.000Z"
}
