{
  "eyebrow": "Pricing",
  "headline": "Pick the plan that matches how fast you want to ship.",
  "subheadline": "The live generator stays open to everyone, but paid plans unlock real customer dashboard access, stronger throughput, and the connected checkout workflow.",
  "tiers": [
    {
      "name": "Free preview",
      "price": "Free",
      "priceDetail": "5 guided commands",
      "description": "Use the voice-first generator, inspect the rendered site, and confirm the offer before you upgrade.",
      "features": [
        "Speak or type the brief directly on the homepage",
        "Prompt-specific preview with SEO and FAQ structure",
        "Sandboxed preview keeps live ad slots protected",
        "Upgrade only when you need more throughput"
      ],
      "ctaLabel": "Open the generator",
      "ctaHref": "/#website-generator"
    },
    {
      "name": "Starter",
      "price": "$9.99",
      "priceDetail": "per month",
      "description": "The entry subscription for solo founders who want dashboard access and a dependable monthly build allowance.",
      "featured": true,
      "features": [
        "Customer dashboard access",
        "Starter plan checkout via Stripe or PayPal",
        "Saved account record tied to checkout email",
        "Built for first launches and simple monetization"
      ],
      "ctaLabel": "Start Starter",
      "ctaHref": "/pricing"
    },
    {
      "name": "Pro",
      "price": "$19.99",
      "priceDetail": "per month",
      "description": "The main growth plan for operators shipping more often and needing the dashboard, previews, and checkout flow to stay fast.",
      "features": [
        "Higher monthly throughput",
        "Saved preview and workspace access",
        "Stripe and PayPal checkout support",
        "Built for weekly production use"
      ],
      "ctaLabel": "Start Pro",
      "ctaHref": "/pricing"
    },
    {
      "name": "Enterprise",
      "price": "$49.99",
      "priceDetail": "per month",
      "description": "The enterprise rollout tier for teams that need stronger control, rollout support, and a governed deployment path.",
      "features": [
        "Enterprise dashboard access",
        "Governed deployment path",
        "Premium rollout support",
        "Stripe and PayPal live checkout"
      ],
      "ctaLabel": "Start Enterprise",
      "ctaHref": "/pricing"
    }
  ],
  "faqHeadline": "Pricing questions buyers ask first",
  "faq": [
    {
      "question": "Can I still test the generator before paying?",
      "answer": "Yes. The free preview flow stays live so buyers can validate the engine before they commit to a monthly plan."
    },
    {
      "question": "What do paid plans unlock?",
      "answer": "Paid plans unlock the saved dashboard record, persistent access tied to your checkout email, and stronger monthly generation throughput."
    },
    {
      "question": "Do Stripe and PayPal both work from the live pricing page?",
      "answer": "Yes. Each paid plan surfaces the live Stripe and PayPal links so the customer can choose the provider they trust."
    },
    {
      "question": "Will ads be affected when the AI generator renders previews?",
      "answer": "No. The generator preview stays sandboxed and ad scripts are stripped from generated HTML so the live AdSense placements on the real site stay untouched."
    }
  ],
  "cta": {
    "eyebrow": "Best next move",
    "heading": "Generate first, then subscribe when the output proves itself.",
    "body": "The live site now keeps the premium generator and the paid dashboard path connected to the same pricing model so the customer flow stays consistent.",
    "primaryLabel": "Open the generator",
    "primaryHref": "/#website-generator",
    "secondaryLabel": "View pricing",
    "secondaryHref": "/pricing"
  },
  "updatedAt": "2026-04-16T00:00:00.000Z"
}
